{
  "task_ref": "Task 1.1 - Initialize Vite Project",
  "agent_assignment": "Agent_Frontend",
  "memory_log_path": "Memory/Phase_01_Setup/Task_01_ViteInit.json",
  "execution_type": "multi-step",
  "dependency_context": false,
  "ad_hoc_delegation": false,
  "task_title": "Initialize Vite Project with TypeScript",
  "task_reference": "Implementation Plan: **Task 1.1 - Initialize Vite Project** assigned to **Agent_Frontend**",
  "objective": "Create a new Vite project with the TypeScript template.",
  "detailed_instructions": [
    "Complete in 3 exchanges, one step per response",
    "Use the latest version of Vite and npm for initialization",
    "Follow the sequential steps exactly as outlined in the Implementation Plan",
    "Verify each step completes successfully before proceeding to the next",
    "Document any version numbers or configuration choices made during setup"
  ],
  "expected_output": {
    "deliverables": [
      "A functional Vite project directory with all dependencies installed",
      "Verified application running successfully on development server",
      "Confirmation of TypeScript template integration"
    ],
    "success_criteria": "The default Vite React TypeScript application loads without errors in the browser and the development server runs successfully",
    "file_locations": [
      "extravagant-hello-world/",
      "extravagant-hello-world/package.json",
      "extravagant-hello-world/tsconfig.json",
      "extravagant-hello-world/vite.config.ts"
    ]
  },
  "memory_logging": "Upon completion, you **MUST** log work in: `Memory/Phase_01_Setup/Task_01_ViteInit.json` following `guides/Memory_Log_Guide.md` instructions."
}